[
  {
    "id": "2026-05-promo-1",
    "image": "https://picsum.photos/seed/may1/800/500",
    "startAt": "2026-05-01",
    "endAt": "2026-05-31",
    "zh-TW": {
      "title": "五月美肌煥新月",
      "description": "AuJet 深層導入搭配玻尿酸補水，喚醒夏前肌膚光澤。本月諮詢享專屬優惠。"
    },
    "en": {
      "title": "May Skin Renewal",
      "description": "AuJet deep infusion with hyaluronic acid restores pre-summer glow. Inquire this month for exclusive pricing."
    },
    "ja": {
      "title": "5月のスキンリニューアル",
      "description": "AuJet 深層導入とヒアルロン酸の組み合わせで、夏前の肌のツヤを取り戻します。今月のご相談で特別価格。"
    }
  },
  {
    "id": "2026-03-promo-3",
    "image": "https://picsum.photos/seed/promo3/800/500",
    "startAt": "2026-03-01",
    "endAt": "2026-03-31",
    "zh-TW": {
      "title": "CO2 氣體療程組合方案",
      "description": "二氧化碳搭配 AuJet 導入，促進微循環、改善膚色不均。立即諮詢專屬方案。"
    },
    "en": {
      "title": "CO2 Gas Combo Package",
      "description": "CO2 paired with AuJet infusion boosts microcirculation and evens skin tone. Inquire for a custom plan."
    },
    "ja": {
      "title": "CO2ガスコンボパッケージ",
      "description": "CO2とAuJet導入の組み合わせで微小循環を促進し、肌のトーンを均一に。カスタムプランはお問い合わせください。"
    }
  },
  {
    "id": "拉店生日快樂",
    "image": "https://picsum.photos/seed/promo3/800/500",
    "startAt": "2026-03-10",
    "endAt": "2026-04-31",
    "zh-TW": {
      "title": "raden我愛你",
      "description": "大家都去訂閱"
    },
    "en": {
      "title": "CO2 Gas Combo Package",
      "description": "CO2 paired with AuJet infusion boosts microcirculation and evens skin tone. Inquire for a custom plan."
    },
    "ja": {
      "title": "CO2ガスコンボパッケージ",
      "description": "CO2とAuJet導入の組み合わせで微小循環を促進し、肌のトーンを均一に。カスタムプランはお問い合わせください。"
    }
  }
]
