[
  {
    "id": "2026-05-summer-demo",
    "image": "https://auvita.tw/images/promotions/2026-05/2026-05-summer-demo_web.jpg",
    "startAt": "2026-05-15",
    "endAt": "2026-06-15",
    "zh-TW": {
      "title": "夏季肌因槍特惠（範例）",
      "description": "夏季限定 8 折"
    },
    "en": {
      "title": "夏季肌因槍特惠（範例）",
      "description": "夏季限定 8 折"
    },
    "ja": {
      "title": "夏季肌因槍特惠（範例）",
      "description": "夏季限定 8 折"
    },
    "link": "https://www.bnext.com.tw/article/90591/hermes-agent-procedural-memory"
  }
]
