[
  {
    "id": "2026-03-promo-2",
    "image": "https://picsum.photos/seed/promo2/800/500",
    "startAt": "2026-03-01",
    "endAt": "2026-03-31",
    "zh-TW": {
      "title": "AuJet T6 新品上市",
      "description": "第六代肌因槍正式登場，速度提升 30%、霧化更細緻。歡迎洽詢體驗。"
    },
    "en": {
      "title": "AuJet T6 Now Available",
      "description": "The 6th-gen device is here — 30% faster with finer atomization. Contact us for a demo."
    },
    "ja": {
      "title": "AuJet T6 新登場",
      "description": "第6世代デバイスが登場。速度30%向上、より微細な霧化を実現。デモのお問い合わせはこちら。"
    },
    "archivedAt": "2026-05-13T08:48:26.776Z"
  },
  {
    "id": "2026-03-promo-1",
    "image": "https://picsum.photos/seed/promo1/800/500",
    "startAt": "2026-03-01",
    "endAt": "2026-03-31",
    "zh-TW": {
      "title": "三月春季煥膚月",
      "description": "搭配外泌體精華，享受 AuJet 深層導入療程。本月預約享早鳥優惠，名額有限。"
    },
    "en": {
      "title": "March Spring Renewal",
      "description": "Pair with exosome essence for a deep AuJet infusion treatment. Book this month for early-bird pricing — limited spots."
    },
    "ja": {
      "title": "3月スプリングリニューアル",
      "description": "エクソソームエッセンスと組み合わせた AuJet 深層導入トリートメント。今月のご予約で早期割引。"
    },
    "archivedAt": "2026-05-13T08:48:26.776Z"
  }
]
